顧客ID,顧客区分,最終接点日,前回内容,関心テーマ,次回提案候補,次回連絡日,担当者,メモ
C-001,既存,2026-04-25,基礎研修後のアンケート確認,業務棚卸し,フォロー研修の案内,2026-05-08,担当A,資料の簡素化を希望
C-002,見込み,2026-04-28,初回相談で課題ヒアリング,フォーム受付,受付台帳テンプレート紹介,2026-05-10,担当B,操作デモを希望
C-003,既存,2026-04-30,権限設定に関する相談,Drive管理,権限ルール表の提案,2026-05-09,担当C,管理者確認が必要
C-004,見込み,2026-05-01,資料請求への返信,AI活用,Gem設計ワークショップ紹介,2026-05-13,担当D,無料範囲での説明を希望
C-005,既存,2026-05-02,月次運用支援の確認,レポート作成,週次要約テンプレート紹介,2026-05-16,担当A,報告書の定型化が課題
C-006,見込み,2026-05-02,オンライン相談の日程調整,CSV整形,GASミニデモ紹介,2026-05-12,担当B,Excel作業が多い
C-007,既存,2026-05-03,通知設定の相談,期限管理,Calendar連携案内,2026-05-15,担当C,通知過多を避けたい
C-008,見込み,2026-05-04,研修内容の比較相談,DX推進,6回構成の説明,2026-05-17,担当D,初心者向け資料を希望
